id,user_id,bio,city,country
c4f642c6-662d-4bd5-afba-d07f3cf1ea6e,e1e6fff0-b6d8-48db-89c7-5edec811e4bb,Away third tough nation.,Rawalpindi,Pakistan
3c738075-31e1-4fd2-9214-ea6b21f3d806,afadc17b-aeef-46bf-8e24-a9c6922da3c0,Need involve among half value win always group. Project government nice themselves wind.,Islamabad,Pakistan
0909b3b7-9707-45c4-868c-0dbabbd98fb5,d1c2d050-cf9d-4d45-8a8e-5903abe06352,Ten wish specific thing agent.,Quetta,Pakistan
95334e8e-ea9f-4933-bcdd-30da8a31655d,d66060fb-d718-40a7-911f-76c796612a7d,Soon ten specific environment skin blue. Teach develop staff.,Karachi,Pakistan
89a73e23-4687-47dc-8e43-d1addcdcb762,7ac4f7fa-d333-4cff-9633-6e87d1ae085b,Figure somebody dinner age cover foreign. Whom evidence political hundred.,Rawalpindi,Pakistan
b6729fb7-9dda-45a0-b591-b336416004fd,a8e2d07e-d089-4bf8-aeec-c66fd86d929c,Voice boy wife condition while enter. Others generation skill job.,Lahore,Pakistan
e54e72b2-830e-401d-ac51-063d7a87bc53,32b8f5fa-bbde-4c6e-8ed2-36869ed0e663,History office effort remember. Mind southern rather.,Quetta,Pakistan
90022d2f-05be-4098-aa45-46ef0436778a,28e57c21-1f59-4661-8c57-f01cade0e762,Issue we TV perhaps professional by.,Islamabad,Pakistan
c5419852-a085-48fc-a764-f8e321104287,eaca3481-ec4e-4b61-9824-fb2f0c368f09,Finally impact I fast camera inside wait.,Quetta,Pakistan
0cff8bbf-de8d-4631-940f-9dd893b031f1,6aff81ce-1c75-4e37-935e-c64cfafd17a7,Notice image street fight decision size parent focus.,Multan,Pakistan
ba168508-3b00-4ba8-9f51-bfcdb4ce9c41,95f00473-6a47-498d-8838-6d8e40d46481,Put memory soldier where save probably. Middle plan friend stand seem.,Quetta,Pakistan
983eddc2-f57e-47a7-898e-331cbfa225fd,4f9ef3c9-28c6-4880-ada2-af225fb5a240,Southern challenge animal worker particularly.,Peshawar,Pakistan
be46519b-98d6-477d-a867-37ccecff722f,8ba056f6-170f-4e24-a917-e333f6ca8bb5,Increase picture create recent manager during prevent.,Quetta,Pakistan
71bc1193-e7c7-4e39-8a4c-cab74e81336a,09f7b0ef-bed3-4f57-bcf6-78f42e31d110,Sing despite sound receive.,Islamabad,Pakistan
a4e97d80-7ff2-4234-99f3-6db2a80126ad,cdc1ab92-990d-4024-8bce-62fa283e652f,Newspaper true building. Soon property write other.,Quetta,Pakistan
c5c4d22b-6d50-46fa-b7ee-ff93beeb9465,c8d21efe-c5cb-487f-b885-e5d4918f370d,Spring throughout interview trade knowledge city technology late. Style everyone sing machine dream.,Quetta,Pakistan
8b412f5e-094d-4257-8d8c-11feb77477de,36a18477-648e-40cd-beef-4fa882640fe3,Require doctor from throw. Catch discuss really relationship.,Faisalabad,Pakistan
e77c41a7-dde3-4c7d-9d57-6aa70497ddd3,d54415c8-33a1-4857-b739-8db360720024,Imagine my indeed deal information toward.,Rawalpindi,Pakistan
5b24731a-7559-4e98-b045-22187dac03de,73912f57-bc29-4b4e-81f4-9b32d7b66aa6,Task she herself. Wall fear hope.,Faisalabad,Pakistan
e771dfe8-c6ab-449e-9a3e-437143e13c06,511f27ce-a37a-4b77-86ce-775b73247463,Section national owner determine detail job ahead. Protect something right subject try wonder.,Quetta,Pakistan
b51a5146-56f4-4b6f-a412-839299cafba3,8fbd6bdc-9d81-419a-9953-510f95aad2a5,Trade option production. Poor career left anyone.,Rawalpindi,Pakistan
af02d5ea-6f71-4303-a75f-8ba220987649,b3ddac07-c369-416c-bb4e-032e15697685,Deep force seven here sell story. Strong like see appear weight.,Faisalabad,Pakistan
d44bc655-49ea-451e-8332-68c1d3a98843,5f783559-b6af-4250-b8c9-ef9f96e969a3,Sit prepare senior wear.,Quetta,Pakistan
e8f128c6-e7c9-4d1b-94d1-0f2b1427041f,cd528400-c83c-4407-ab3d-0281dbfb34ab,Perform draw list.,Lahore,Pakistan
5817ca5a-2dc2-4fe1-bd22-049e12cbeb4f,1ed63b1c-e14c-46e9-8da7-3cfd3cb2e65b,Way let eight hard paper white responsibility.,Faisalabad,Pakistan
0d222c2f-8ff1-4815-9d9d-12c6a05ae496,0f3ff99c-6bcc-4579-9788-11a3baf93d77,Blue agent find quality when.,Rawalpindi,Pakistan
f1a6328c-64c3-4c03-a604-0efb66bad5af,90571860-2706-417b-a4f6-1ac855b64ef3,Away real physical big significant. South someone not American mouth product attention positive.,Faisalabad,Pakistan
77ddcf67-d6b9-4c00-8a0c-8aada212eac8,4350ceb1-35da-4532-b53c-eea21f9be5a3,State black whether player stock religious.,Multan,Pakistan
203b8905-f765-48d7-9f75-04ab80e8c4ca,16d6d76a-d06d-4f5f-9109-f0a56e5ae30a,Safe whole establish space. Simple let stay or focus early various.,Multan,Pakistan
efcc47d8-2fb9-4df0-b104-06ae0d6d4d63,ecade717-56b6-4525-8e40-28f73d428999,During let particular her agreement surface consider.,Lahore,Pakistan
1e8eb6ee-cb46-4f17-8181-c3928769f087,31085da9-bfc4-44bd-80c8-8dc16a164938,Something future they red everybody act.,Islamabad,Pakistan
937e88f1-1916-47fd-b182-463aa8012ac9,a3867652-8df8-44b6-a11a-05f671a13d34,Drop image new drive.,Islamabad,Pakistan
e738218e-7b25-4a57-abb3-2be28a1158e3,d7110384-dc32-403f-936b-6e7e5fda3fe5,Large admit family identify during professional hard. Most international second former reflect even edge.,Rawalpindi,Pakistan
f763411e-415d-48b7-be75-99077455a437,93727c5f-916e-4277-a22b-d2693fb56773,Firm sea week real course.,Peshawar,Pakistan
54774b15-f7db-4d2a-b30f-f07270c0689e,2fa81437-f059-44a2-8d99-0208348b9d45,Right with modern executive beyond. Fast guess few remain call.,Islamabad,Pakistan
9e51dab8-350f-49b9-8c23-8fcf3d169907,3815b5a4-1ac8-40d8-8dfc-54ac0f583933,Network recently call.,Rawalpindi,Pakistan
99646f95-b08a-4ed7-b286-5dd75f611737,8c41d771-1c53-47f0-9b03-437ca554ee2d,Their off light key. Whole education technology box.,Lahore,Pakistan
0e0d443a-0c98-471e-9360-52e89c0df7de,b0ba15b3-0cf8-430c-9c24-f1e7a56ed191,Man officer rather charge specific we.,Peshawar,Pakistan
bca96524-79fc-400c-9161-b1ef8ccbede9,84cbf8e8-4655-4b2f-b86b-66700ce088ca,Budget share paper so difficult.,Peshawar,Pakistan
4d17d20c-9a38-44ce-a857-f409df6c6d2c,1bd131e8-661d-42d1-87a1-473adbe62c76,Late kind team wrong figure perform. Whether between several personal enough ball dream necessary.,Multan,Pakistan
1db882c2-b31d-426a-8ec2-1f969eb67128,a0810b2e-137a-4c5f-84d1-e8ddd5fa9857,Impact ready like.,Quetta,Pakistan
66769c43-9de2-43e6-99fd-89b40febe4f2,688e0a6e-2ec3-46d8-9c51-d8b5998d51a5,Explain executive teacher author do.,Peshawar,Pakistan
5ad0a61e-d47b-4a6e-9e5d-74dac854f40e,0f0de6f9-e422-4c70-91cd-95dfb8a646bf,Operation sound cup boy different chance enter central.,Karachi,Pakistan
19de1682-1ef5-41cd-a3d7-9332e884e542,dde6fddf-d329-423e-b43c-b8301977a710,Society organization station TV.,Rawalpindi,Pakistan
b2c74d0a-b2de-481f-94d6-9139c26bb4a5,6810540c-4442-4ccc-aa77-9fc7ca5d6548,Light fight I evening. Management ball always it focus economy before.,Peshawar,Pakistan
d3efb813-b9fa-48a3-8878-a84daea39eda,1e8b15ee-2d61-490d-aedd-c752925dfcd0,Week yourself public especially American series like prepare. Consider one play man before.,Peshawar,Pakistan
672598ef-4b53-4d5e-9109-2412fc74e693,c3391703-0ed1-49b0-8c39-ffc48c7c41ef,Four prove tax form really explain. Spend nearly lawyer fire follow wife.,Karachi,Pakistan
869ea043-a463-4e9e-bc0f-0999737639dc,dd7de8ce-9c33-4ec1-afbd-41ee3c05558e,Stay ability thank left approach million performance. Personal service data near until just recognize.,Peshawar,Pakistan
4fb7a75a-8ca2-435f-ae29-567bc57dfa37,f6c9d945-1649-4626-8599-55d7a264b985,Win participant dream.,Quetta,Pakistan
a2fec380-ea66-4021-81df-927f041e9f23,78e0e4d1-3def-4560-a0f6-0cb315558662,Nearly need behavior yeah tree.,Karachi,Pakistan
02732fe1-8bc1-4884-a186-4294cafdbd42,1e69ef9f-3859-4ae9-a5f6-650beb8d89d5,Positive child usually factor. Indeed lot line lead certain.,Multan,Pakistan
9e019157-a07f-4e1e-92ef-d69ac9f59e88,1d924c77-553b-4a91-9077-8b5e20341302,Meet these tell everybody so increase various meet.,Faisalabad,Pakistan
acf7dfa3-f76d-4c76-bd14-f08bb09fd244,58be5f8f-f7e7-4849-a42e-225d42b2d707,Rise study oil process tend.,Peshawar,Pakistan
82da7b67-d9df-4eea-9b97-9cb5a15648b3,4c215462-f926-475e-8d84-70dc66dc3a6d,Machine forward several help usually thank wonder. Occur do simply analysis seat.,Peshawar,Pakistan
b798e2c8-b43c-4ffc-86ee-8ca0dcc57691,f049e62a-b9a9-4147-9f6d-0039ff1a1d62,Write society present charge who call. Forward beyond suddenly between treat address century that.,Rawalpindi,Pakistan
bf4d7524-408f-434c-a6f9-5059551c9c83,93b91c6c-5d85-4d37-96ee-54b962ead0a1,Light wide full realize.,Quetta,Pakistan
4ab6a868-5515-405a-889f-8953a96d298f,36e9fa6c-9586-443b-9798-f31b8343d752,System teacher here first responsibility service.,Rawalpindi,Pakistan
1b529935-70c4-43aa-b58c-04917253d1bd,67d7a890-fedf-4ca8-ae03-51128c4dfc22,Pay doctor range. Young section its better plant.,Faisalabad,Pakistan
e71bd313-6c85-4243-ba24-e01496f4c546,c01eaf98-af64-44d3-8d8b-812455ca2330,Coach federal ahead food argue grow.,Peshawar,Pakistan
9d19d2da-2bc5-490f-bb25-e9c696454ece,813222d9-41d1-463b-9bbd-5a5785795783,Each include radio conference. Bad that people drive.,Quetta,Pakistan
6b225200-fc5b-4fdf-87d8-9a55e06b07b5,59265a90-abaa-4747-a715-23a1c9300962,Discussion point least project. Top quality citizen kid generation onto police.,Karachi,Pakistan
a86f656c-b9e9-4e76-b011-d79d400e4727,186ca3d1-e53b-4443-aed3-12994f44bc07,Lead few yourself table blood. Occur offer yeah far within probably.,Peshawar,Pakistan
b668bf26-b35a-4d3c-a251-8ed99efb82b5,101511bd-b966-4f65-b26a-ea6620e0b685,Not rate seat.,Multan,Pakistan
10600502-61e6-4c3a-aa61-1a1fc962bbc4,4a50e8ae-85d6-4106-9df9-5b322cbb88d6,Seat strategy total simply discover soon despite couple.,Peshawar,Pakistan
57f6ca96-22c6-4078-b301-47af811a2a8e,2bb6aabf-6e16-4ac9-85f0-426e46054282,Pick tough position final.,Islamabad,Pakistan
f6d47cf8-c4fc-444b-b69c-59c0f5d53601,a96c0e6a-8f24-4b8d-aae0-9df39466c3ab,Often run bed. Force indeed customer skill theory.,Quetta,Pakistan
edf967d8-08b7-4471-bce3-f92936dc14b7,12a71b02-d2cc-49ab-9b4e-5c03ed1c9201,Maybe evening clearly trial want whose far. Sound life away senior difficult put.,Islamabad,Pakistan
704ab185-6ca2-4113-a21d-6baa4bd4b7f3,6c53df5e-62e7-4528-a90b-f9b5e6b9c7a1,Hand so add Mr lawyer pull public. Herself police he push likely people wall foreign.,Karachi,Pakistan
ba56094d-7189-4099-90d5-d2a3cd5752eb,09fb571c-12e0-4fd0-b8aa-1694c3d46033,Positive play less red power. Cause watch fight manage.,Peshawar,Pakistan
367457d2-2400-42d5-abf3-b5cbfc8a8418,aadd264b-408c-4ed7-be60-b98b27658bbb,Thought career law provide sea.,Karachi,Pakistan
1f15345e-e42c-4530-add9-19b3885e8193,f25377bb-3dee-427d-b121-8f49365ef9a7,Onto risk those pressure street past. Allow have kitchen wear talk.,Lahore,Pakistan
9f49f3fc-4619-4600-80db-445c17cd2279,289f1a24-a139-46cd-a89c-e00f41f16d03,Name within grow huge couple business.,Peshawar,Pakistan
e2e319d7-686e-4513-9a86-ea3210dce323,5d87bb33-5ce5-4a48-8c61-52da3c027687,Production politics others again. During call north attention share debate.,Islamabad,Pakistan
8b041122-f6c7-48bc-ba09-d67c2b058f14,d1f13bee-3867-42e0-8bd2-a7c71b9d0bb2,Forget challenge too able teach.,Quetta,Pakistan
16a20087-5890-4db7-a51e-13c5f24e4cb7,367b509a-477e-4452-a0a0-dd186d0f3fb2,Music sometimes body term.,Islamabad,Pakistan
a9eed71d-b6dc-42ef-8190-54c2a192b059,3b32de10-bd5c-4ccf-9d77-4d6e6120cdc7,Group small open.,Karachi,Pakistan
d6b5915f-4c1d-4a64-8744-de12b6111804,32beed40-a8b3-44b2-9a6a-126ba2efdd48,Enter camera inside box.,Faisalabad,Pakistan
b34eb874-5a67-42c4-aea5-69c63b3653cb,6ada03ff-2bb8-456f-bdeb-99f04e6e979a,Large gun order later develop past road.,Peshawar,Pakistan
8e6bbbe7-1b28-42de-9348-4ac5827937b3,222b7090-8651-479a-b3f2-d42dc1399c9d,Leader who article look husband. Make travel available ball.,Multan,Pakistan
15c94dc3-49c4-4450-be2b-8a4f1cbd6c68,0c76c53f-f912-455b-b95c-efbbefb24aed,Assume every plan nature. Herself our far measure involve soldier.,Rawalpindi,Pakistan
